,customer_id,star,enroll_date,content
207,minjung han,5,2025-07-01,배달비 무료라 편하게 자주 이용하고 있어요~ 불편한 사항도 바로바로 대응해줘서 좋아요~
208,Hyeonlee Lee,4,2025-07-13,"다 좋은데, 배민이나 요기요처럼 메뉴별 리뷰 필요해요.... 내가 먹고 싶은 메뉴의 리뷰가 별로 없을 때 너무 고민돼요"
209,정재환,4,2025-07-12,결제 시 한번 더 물어봐주면 좋을 듯 싶습니다. 주문금액 확인하려다가 갑자기 결제 되어 당황했습니다.
210,김지운,5,2025-07-20,배달도 빠르고 음식물도 안전하게 갖다줘요..주문도 편리합니다
211,꿀꿀보스,5,2025-07-21,배×보다는 좋긴한대...가게전화가 연결안되잇어서 오늘도 소스가안와서 전화하려다가 전화번호가없어서 이것저것눌러서 받긴했는데 좀불편햇어여
212,그린애플,5,2025-07-06,편리해요 배달현황을 실시간으로 표현해주는 그래픽도 만족합니다
213,JW Shin (ShinJW),5,2025-07-09,요청사항도 저장 기능 만들어주시면 안되나요? 없어서 복사 햐놓고 클립 보드에서 찾아 붙여넣는 중입니다.
214,쿠팡맨,4,2025-07-13,배달료는 없지만 음식 자체가 매장이란 달라 결국 돈을 더 내지만 그래도 저렴하게 주문할 수 있어 좋네요
215,박서희,5,2025-07-20,"늘 잘 사용하고 있습니다. 배송, 배달은 쿠팡만 이용하게 만드는 힘이 있네요^^"
216,P은희,5,2025-07-11,배송 시간과 오는 과정도 상세히 보이고 배송료도 저렴해서 좋네요.
217,김미현,5,2025-07-13,쿠팡이츠 너무 잘사용하고있어요 어디쯤오는지도 알수있고 시간도 예상시간보다 빠르고 배달시키기에 참 좋은거 같아요
218,지하고등어 (배달차.),1,2025-07-14,2틀 동안 네트워크 연결실패 라고 접속이 안됨ㆍㆍ삭제후 재설치 해도 같은 증상임
219,임정민,5,2025-07-17,무료배달과 배달위치 확인할 수 있다는 점이 매우 만족스럽습니다.
220,라파조아,5,2025-04-25,첫인상은 별로 였지만 그 이후로 계속 잘 쓰고 있어요 상담사 연결도 편하고요 목록에 최소 주문 표기 없었는데 생겨서 리뷰 다시 답니다 좋네요!! 매번 눌러서 확인해야하는 점이 불편했었거든요
221,뚜비두밥,1,2025-07-04,자꾸 즐겨찾기 들어가면 렉 걸리는데 이거 언제 고치려고 하십니까?? 그리고 알림 기능도 광고 알림이랑 배달 알림 기능 분리하세요
222,김지현,5,2025-07-04,새벽엔 배민에 비해 없는 업소가 많고 같은 업소도 메뉴가 없는 업소도 있지만 할인도 되고 와우 회원은 배달비가 무료라 좋아요
223,ma n,4,2025-05-26,음식 배달왔는데 순서 바꼈다고 음식 안주고 다른 곳 먼저 들렀다가 오는 시스템은 대체 어떤 시스템인가요 괜히 배달원들만 동선 꼬이고 소비자들도 기분 안 좋아질 것 같습니다.
224,4885,1,2025-05-11,와우회원가입하고 12000원쿠폰 받았는데 첫주문만 주는 쿠폰이라 쓰지도못하네;; 첫주문 조건없이 그냥 주면 안되나요 받긴 받았는데 못쓰는걸 받아서 짜증나네요
225,동 현박,5,2025-05-12,주로 여기어플로 배달주문합니다 저는 평소에 세심한 성격인편인데요. 이 어플로 배달 시키는게 가장 효율적입니다. 문의 담당 분들도 굉장히 친절하시고요. 왠만해선 저는 이 배달 어플을 계속 쓸 예정입니다~♥ 화이팅하십시요~♥💕
226,박경필,5,2025-07-21,"그 유명한 쿠팡이츠를 이제야 이용시작하여 애용하게 됐네요. 다른 어플그동안 이용했으나 이제야 갈아탔고, 진작 갈아탔어야 했다는 후회중입니다."
227,비타,5,2025-06-03,요즘 배달비 어떻게든 더 받아먹으려 하는 어플이 판을 치는데 쿠팡 와우 멤버십 유저한테는 혜택이 너무나도 좋아 잘 애용하고 있습니다 다른 어플에 비해 점포가 많이 뜨지 않은 건 좀 아쉽지만 그래도 할인도 많이 해주고 배달비도 무료고 진짜 효자 어플이에요 망하지 않게 평생 유지 부탁드립니다!
228,마뚜루,5,2025-05-14,혜택도많고 이벤트도 많고 배달비도 무료고 참 좋네요 메뉴값이 조금 차이는 나는데 그래도 혜택받으니 훨씬싸요 배달 위치도 보이니까 엄청좋아요
229,ᄋᄋ,1,2025-06-07,"입대전에 마지막으로 뭐가 먹고싶어서 햄버거 메뉴좀 보다가 결제버튼 한번 잘 못 눌렀는데 주소지, 요청사항, 결제되는 카드가 뭔지 확인도 없이 바로 결제되었는데 정말 불쾌하네요. 원터치 결제인가 뭔가 쿠팡에서 켜져있어서라는데 쿠팡이랑 쿠팡이츠랑 연동되더라도 결제 관련 설정은 따로 쿠팡이츠에서 가능해야지 쿠팡이 뭔데 이츠까지 자동결제 해버리는지 어이가 없네요. 제대해도 이츠로 결제 안합니다. 업체는 조리중이라고 뜨고 몇분이 지났는데 고객센터에 전화했더니 환불요청하는거냐길래 상도가 아닌거같아서 안한다 했지만 원터치 시스템 하나때문에 가기전에 마지막으로 먹는 한끼식사 다 망쳤네요. 제발 한번더 결제 시스템좀 한번더 확인하게 만드세요."
230,jc k,2,2025-04-05,"와우 회원이면 무료배달 되는 거 + 무료배달 외에도 천 원에서 2,000원 할인된 가게들 볼 수 있다는 점 때문에 쓰고 있는데 와이파이 잘 잡고 있고 5G도 잘 터지는 지역에서 가끔가다 네트워크 연결이 원활하지 않습니다 이 문구 뜨면 너무 빡쳐요. 이게 한 두 번이면 그러려니 하겠는데 오늘까지만 벌써 7번 나왔습니다. 지금도 뜨고 있어서 제 폰 문제인 줄 알고 아버지 폰으로도 해봤는데 똑같습니다. 경쟁사 언급 안 하고 싶지만 배민은 결제 제외하곤 앱 자체적으로 트러블 일으킨 적이 없어서 상당히 실망스럽습니다."
231,이승호,5,2025-05-23,무조건 빨리 배달되눈 곳이네요 배달도착 시간이 실시간으로 변경되요 처음에 x시 15분이었던게 30분으로 변경되고 45분으로 변경되고 40분에 도착하니 5분일찍 도착했다고 알림와요 무조건 빨리 배달되는 최.고.중에 최.고.의.앱이네요.
232,S J,5,2025-07-04,메뉴별로 해당메뉴 주문한 리뷰만 모아볼수 있는 기능 추가해주세요
233,테너맨,5,2025-03-15,정말 편리한 서비스 덕분에 삶의 질이 향상된 기분입니다. 빠른 배송과 다양한 음식 선택지에 감탄할 따름입니다. 덕분에 맛있는 음식을 집에서 편하게 즐길 수 있어서 좋습니다. 앞으로도 자주 이용하게 될 것 같습니다. 항상 좋은 서비스를 제공해 주셔서 진심으로 감사합니다.
234,최유민,1,2025-02-09,쿠팡이츠가 빡치는게 배달 중인 상태고 30분 남는다고 떠있는데 이게 늦을 것 같으면 시간이 조금씩 늘어남 ㅋㅋㅋㅋ 픽업 했고 배달 중 18분 남았다고 떠있었는데 화면 보고 있으면 23분 됐다가 다시 시간 15분으로 줄었는데 22분으로 바뀌어 있고 이런식 ㅋㅋㅋ 어처구니가 없음. 애초에 30분 잡지말고 1시간 걸린다고 잡던가 왜 그러는거임. 개선 좀 해주세요 진짜 짜증나네 한두번도 아니고. 음식점들 20분 30분 걸린다 나와있는거 꼼수치는거고 다 개뻥임.
235,Xandy kim,3,2025-05-08,"알림이 너무 많아요.주문확인,픽업,근처왔음,배달완료,후기. 벌써 몇개야 이게. 알림 카테고리 만들어서 받고싶은 알림만 받아볼수 있으면 좋겠어요. 실행하면 평점창 뜨는것도 예전같이 그냥 없었으면해요"
236,Sylvia P,4,2025-03-01,편리한 선택주문과 빠른 배송👍을 특급칭찬합니다. 수수료때문인지 맛소문 햄버거집이 OUT되어 안타깝습니다. 불편없는 다양한 맛집선택할수 있도록 적정한 수수료를 고민해 주십시요.
237,jaewan bak,1,2025-07-08,fds 오류???를 왜 해결해주지 못하는지 이해가안됨 ++ 짜증나게 왜 탭넘길때마다 광고동의 무작위로 넣어두냐? 이거법적으로 제제못하나 진짜 짜증나게 넘기다가 동의눌러서 취소하러가야하고 진짜 짜증나게 만들었네
238,김선식,5,2025-07-13,빠르고 신속한 배달로 시원하고 맛있는빙수를 먹을수있었네요~^^ 감사합니다~☆☆☆☆☆
239,JungYun Yang,5,2025-06-28,"잘사용중. 직관적이고 편해요. 단지 배달집 고를때도 지도로 볼수있었으면 좋겠는데, 저만 원하겠죠?.."
240,안수정,5,2025-06-29,와우가입으로 쿠폰이 나와서 첨으로 직접 배달앱 사용해봤는데 좋네요 앞으로 자주 이용하게 될까봐 두렵네요 ㅋ
241,박인숙,5,2025-07-03,빠른 배달 해 주셨구요 빵도 맛도 파란라벨 좋아요^^ 맛있는 빧 빵 서비스도 주셨네요 감사합니다 맛있게 먹을게요
242,Song,5,2025-06-23,쿠팡이츠 담장자님께 현재 각 매장마다의 메뉴 아래에 메뉴마다 해당 제품의 리뷰가 몇개씩 달려있는지 적혀있는데 해당 리뷰 숫자를 클릭하면 해당 제품의 리뷰만 따로 모아 볼 수 있도록 해주시면 쿠팡이츠 사용에 더욱 만족할 것 같습니다.
243,JS KIM,5,2025-06-24,쿠팡와우회원이라서 편리하게 잘 쓰고 있어요. 무료배달에 이벤트도 자주해서 좋아요
244,여우별,5,2025-06-29,쿠팡앱을이용중인데여 쿠팡이츠가 있다고해서 써보니까 너무편해여 쿠팡이랑 연동되니 더욱더 편합니다^^ 이용하기도 너무 편안하고 좋습니다
245,박은미,2,2025-06-27,다른 어플보다 쿠폰주면서 저려한듯하지만 음식 가격이 비싸네요 눈속임 와우 멤버시해서 저렴한거 같지만 결코 그렇지않음
246,정영훈,1,2025-06-24,주문서 작성에 들어가서 설정이나 주문을 하려할때 인터널 에러 /오류가 지속적으로 발생합니다
247,김숙,5,2025-06-24,주문이 주소지가 잘못 되어 상담을 했는데 아주 친절하게 처리해 주셔서 너무나 감사합니다. 우리집 쇼핑의 메카~~ 구팡이츠 최고예요.👍👍👍
248,정현숙,5,2025-06-27,주문하기 편하고 메뉴나 검색도 다양해서 좋아요
249,KU K,2,2025-02-19,배달 1분이라도 일찍 도착하면 알림 뜨면서 늦는 건 20분이 되어도 알림 하나 없군요 발생 원인을 짚는 게 아니고 늦었을 때 알림이 없다는 말을 한 건데요 앱 자체의 문제인데 내부 과정에서 문제가 있을 걸로 보고 논의하겠다는 건 남탓이죠 지금도 예정 시각보다 늦어도 알림 없는 점이 고쳐지질 않았네요
250,데이즈,4,2025-02-23,잘쓰고 있음. 근데 매장 직통으로 전화를 못하는 게 아쉬움. 뭐가 빠져서 오거나 잘 못오거나 금액차이 같은거 매장이랑 빨리 해결하고 싶은데 이게 안됨. 그리고 매장 실수로 취소하고 환불 받는 거에 왜 수수료 떼이는지 납득 안감. <-이게 제일 짜증남.
251,S sI,2,2025-02-23,수저 포크 선택하는거 없어졌나요? 선택하는거 자체가 없는데 왜 자동으로 수저포크x되어서 주문되는거죠? 체크란 자체가 없다고요 뭔 개같은 경우입니까 체크하는거 자체가 없는데 그럼 주문영수증에는 아무것도 적혀있질말던가 주문영수증에는 (수저포크x) 라고 표시되면 내가 수저포크를 안받길희망하는게 되어버리잖아요
252,장부훈,5,2025-07-08,처음엔 주문할 곳들이 많이 없어서 사용안했는데 이제는 많은 먹거리들이 있어서 배x요xx 끊고 쿠팡이츠에 정착중이에요.^^
253,날라리,5,2025-07-12,주문확인하고 조리 배달과정을 알수있고 배달 소요시간도 알수있어 앱사용하기 편하고 좋아요
254,운명은 C minor,5,2025-07-14,무료배달에 쿠폰도 잘주고 배달도 빨라요ᆢ음식도 다양해서 정말 좋아요
255,윤종문,5,2025-06-23,회비 대비 콘텐츠 다양하고 무료배송까지 나스닥 상장 이유 있네요.굿~~~
256,신경숙,5,2025-06-03,주문 부터 배달까지 실시간 알림이 오니까 무작정 기다리는 지루함이 없어서 좋습니다 배민만 이용하다 와우가입하고 쿠팡이츠 이용하는데 배달도 무료고 가게들도 많고 두루 만족합니다~
257,최경아,5,2025-05-23,좋긴한데 항상 쿠팡 메인을 통해 들어가야하는 점은 불편해요. 그것 뺴고는 배달 앱 중에서 제일 좋아요.
258,김,5,2025-05-21,잘 쓰고 있습니다. 그런데 검색이나 필터링에 운영시간도 볼수있음 좋겠습니다
259,김김미영,5,2025-05-27,무료배송에 목숨걸고 있네요. 잇츠를 이용하면 기분이 좋아요. 오는 과정도 볼수있어요. 적극 추천합니다.
260,DI Lee,1,2025-05-31,"별 1개도 아까운 곳입니다. 어느 장소에서 무얼 시키든 배달지연은 기본이 되는 곳입니다. 배달지연이면 쿠팡이츠는 배달지연되었으니, 1000원 할인쿠폰 주고 개선하려는 점을 찾을 수 없는 곳입니다. 고객센터는 연결이 안되고, 된다고 해도 돌아오는 답은 기다려주세요 라는 말 뿐인곳입니다. 배달음식이 잘못되면 쿠폰으로 무마하려는 곳입니다. 실질적으로 소비자는 돈으로 구매를 하는데, 왜 돈이 아닌 쿠폰을 주는 거죠? 참 이해를 할 수가 없네"
261,s이은,5,2025-06-11,가격적으로도 배달 시간으로도 쓰기 너무 좋아요~! 가게들 많이 늘려주세요☺️
262,김봉기,5,2025-05-10,모든게 한눈에 볼 수있어 좋네요. 등록 가맹점이 좀 더 다양했으면 하는 아쉬움도 ㅡ
263,이유천,3,2025-06-01,배민에 비해서 불편한게 너무 많음. 추천목록도 맨날 똑같이 시켰던데만 보이고 문 안열은데 보여줘서 새벽엔 시킬수가없음.
264,고은미,5,2025-06-14,편리하게 이용할수 있는 앱이구요~ 할인을받아 더 저렴하게 이용 가능해 좋습니다~^^
265,송민주,5,2025-05-23,최고에요👍 현당 도착결제도 되면 좋겠어요. 더 많은 사람들이 사용할 것 같네요. 법카 사용 어려운 경우 있네요
266,Acelee “Acelee”,5,2025-06-20,무료배달에 포인트적립과 사용으로 저렴하게 맛집과 연결돼있어 너무 편하고 즐겁네요^^
267,안승찬,5,2025-06-01,참신하고 너무 좋은 앱입니다. 회원 등록 후 무료 배달되고 기사님 위치도 확인 가능하고 너무 마음에 듭니다. 착한 회사로 거듭 번창하기 바랍니다.
268,Google 사용자,5,2025-05-17,쿠팡앱으로만 수문하다 배달앱을 통해 주문했는데 다양한 이벤트와 더욱 편리한 주문인터페이스가 있는줄 몰랐어요
269,짱찡가tv,5,2025-05-21,다른 배달 앱보다 가격이 싸고 배달도 빨라요. 배달비도 조금 더 싼 것 같아요.
270,won p (워니),5,2025-05-18,다른 배달어플에 비해서 배달비를 조금 아낄수 있어서 좋네요 무조건 저렵한것은 아니고 타어플보다 저렵한 매장을 찾아야해요 ㅎ 그래도 만족합니다
271,홍철기,1,2025-05-25,배달하는 기사들이 너무 맘에 안 들어요. 대문은 끈뚝 끊어트리고 물건을 직접 받았는데 봉다리 밑에 흙이 잔뜩 묻어 있고
272,이영채,5,2025-06-09,"저렴한 배달비와 총알배송까지~정말Good👍🏻👍🏻👍🏻 배민으로만 그동안 배달시켰어요. 알뜰배달 한집배달 가게배달이란게 생기기 전,후부터 배달비가 부담된거 사실이예요. 저는 와우회원이었지만 이제서야 누리고 있네요🥲 쿠팡이츠~ 만세🙌 와우회원~사랑입니다❤️"
273,ᄏ첼e,5,2025-06-14,할인쿠폰도 많이 뿌려주시고 쿠폰 최저금액이라던지 그런것도 딱히 없는것 같아서 너무 좋아요!! 앞으론 배*의민* 어플보다 더 자주 쓰게 될 것 같아요.
274,홍준용,5,2025-06-21,배달보기도 편하고 무료로 (연동)배달되는 가게도 많아서 정말 좋네요
275,흑우코인,4,2025-06-01,사용자 경험 나쁘지 않음 솔직히 요즘은 배민말고 이거만 쓰내요. 단점은 아직 타업체 대비없는 프렌차이즈가 좀 많습니다.
276,angela하영,5,2025-06-04,아 쿠팡이츠 진짜 답답해요. 아파트인데도 기사님들이 음식을 다른동으로 가져다주시는일은 진짜 10번중에 2번은 꼭 있고 많으면 4번도 있어요. 근데 타업체처럼 기사님과 연락 할 방법도 없어요. 그냥 상담원분들은 OOOO으ㄹ로 확인됩니다. 미안한 마음으로 3000원 쿠폰 드립니다.. 아니 기사님하고 연락이 되면 잘못 왔을 때 바로 전화드리고 정정배달이 빠르게 되잖아요. 오로지 상담원과 소통하는 건 너무 비효율적이에요. 그냥 무작정 기사님 배달하실 거 다 하시고 다시 오셔서 어딘지 모르는 다른동에 문앞에 둔 음식을 가져다주실 때까지 기다려야한다는 게 진짜 답답합니다. 개선 좀 해야할 거 같아요.
277,OOO오빠야,3,2025-06-06,다른 앱과 가격 비교하면 속임수인걸 알수 있음 배송비가 이미 음식 가격에 포함 여러개 사면 오히려 더 비쌀수도 있음 심지어 포장이 없어 할인도 못 받음
278,송미호,5,2025-06-06,주문간편하고 실시간 배달map 보여주어 좋습니다 잘못온 메뉴 as센터에서 바로확인하고 환급쿠폰 및 추가배달쿠폰도 보내주셔서 잘 썻습니다 배달앱은 이곳만 씁니다
279,박주영,3,2025-05-29,1. 상호만 다른 동일업체 좀 지워주셨으면 합니다. 2. 같은지점 내리다보면 또 나와서 너무 헷갈립니다.
280,김02,4,2025-05-11,무료배달에.... 배송시간 다 좋습니다. 예약배달이 있음 하는 아쉬움이 있습니다.
281,min G,5,2025-05-16,주문할려고 할때마다 배달 최소주문금액이 넘 높아 어떻게 주문하란건가 의아했지만 모든 가게가 다 그렇지 않다는걸 오늘 첨 알았습니다 무배해주기 싫어 그렇게 얍삽하게 설정한 가게들은 앞으로 어떤 앱에서든 안시키고 거를려고요
282,게임하는쿠키,5,2025-05-21,사용이 편리해요. 할인쿠폰도 자동으로 적용되서 까먹을일 없이 좋네요.
283,이레,3,2025-06-08,배달 실수가 너무 잦아요.. 몇 번째 실수인지.. 고객센터 응대는 좋습니다.
284,꼬미와나랑이,3,2025-05-13,결제선택할때 타플랫폼처럼 다양하게 선택할수있음 좋겠어요 포인트차감이라던가 이런부분은 아예안되더군요
285,김강식,3,2025-05-30,사용하기 편리합니다. 다만 배송시간이 점점 늘어난다는 점......
286,윤선영,5,2025-05-27,급할때 쉽게 이용할수 있고 배달○○보담 더 신뢰가 가는 편이라 꼭 쿠팡잇츠를 항상 이용합니다
287,이종순,5,2025-05-23,이용하기 편하고 빠른배달로 늘 믿음이 갑니다 생활 가까이 있어 자주 하게 되네요
288,곽병민,5,2025-06-14,양념통닭도 양념이 맛있고 고기도 부드러워요^^ 후라이드는 바삭하니 양념에 찍어 먹으니 더 맛낫어요 배달두 빠르고 시킬때마다 만족합니다^^
289,Jin roy,2,2025-05-23,메뉴마다 직접 매장 가서 사는거랑 많게는 몇천원 가격 차이가 있어서 여러 메뉴 구입시 배달비 이상으로 더 돈 내는셈이네요..
290,소울팬,5,2025-05-14,다양한 음식들을 쉽고 편하게 주문할수 있어서 쿠팡이츠를 자주 애용합니다
291,김선미,5,2025-06-09,무료로 받을수있는 장점~~ 언제 받을수있는지 시간도 알려주고 배달현황 까지 실시간 볼수있어 좋아요~~^^
292,나나나라라라,3,2025-05-29,"쿠페이머니 충전 만원 단위로 바꿔야 하며, 쿠팡 캐시는 자동으로 항상 최대 값 사용되게 해야합니다. 네이버페이 참고해 보세요."
293,권오일,4,2025-05-18,어떤 매장은 원래가격보다 비싸네요 무료배달이라하고 음식 가격을 비싸게 파는 매장이 있네요
294,갈비맛초코,5,2025-06-09,다양한 음식점과 배달 정보를 확인할 수 있어서 좋아요! 배송도 빠르고 따뜻해요!
295,힐링,5,2025-05-31,아직 가맹점은 많이 없지만 콜센터 응대도 좋고 고객입장에서는 너무 편하네요
296,이장면,5,2025-05-24,최소금액이 너무 비싸게 책정되서 불필요한 지출을 유도하는꺼 같아여 금액을 조금만 낮쳐줘도 지금보다 자주 이용 할수 있을듯하네요
297,s b,1,2025-06-10,지도상 문 위치 확인 후 길안내 하고 자동 방향 전환 좀 추가 해라. 배달단가 후려쳐 배만 쳐 불리냐.
298,조미애,5,2025-05-28,메뉴도 풍부하고 골라먹는 재미도있고. 배달은 로켓배송! 배달기사님도 친절하셔서 매우만족해요
299,Violet Factory,5,2025-05-16,"빠르고 배달 수수료도 저렴해서 너무 좋아요, 기존 배달어플 쓰다가 쿠팡이츠 몇번 써보고 아예 갈아탔습니다♡"
300,WOLF ROBOT,5,2025-06-11,"UX, UI, 편의성 모두 최고의 배달앱. 다만 네이버페이 도 결제되게 해주세요"
301,Andrew Yang,1,2025-05-24,네비 좀 개선해요. 무슨 다리에서 뛰어내려서 배달할까요?? 벽을 뚫어서 배달할까요?? 말 같지도 않은 안내를 합니까!!!
302,노정희,5,2025-06-15,집에서 완전 편안하고 신속한 배달로 맛있는 음식을 먹을수 있어서 늘 감사하게 생각합니다~~
303,dongany @gmail.com Y00498972,5,2025-05-25,배달이 정말빠르고 주문부터 배달까지 모든과정을 한 눈에 확인할 수 있어서 너무 편해요
304,ᄒᄒ복잡한거 싫은데,5,2025-05-28,굳~ 다른앱보다 싸고 빠른 배달~ 쿠폰이벤트가 아쉽지만...전체적으로 굳~~~
305,이수화,5,2025-05-15,할인도 많이 해주고 친절하고 빠른배송 추천합니다.
306,봄봄고고,5,2025-06-14,"다른 배달앱을 이용하지 않고 쿠팡이츠가 처음인데 무료배달도 좋고 정확,신속 맘에 들어요~~"
307,윤정주,5,2025-02-08,다방면으로 실용성을 갖춘 앱 이네요.생활용품.가게용품 뭐하나 빠지는 품목이 없네요 주문하면 바로오고 찾는것도 다 한번에 해결이 되서. 너무좋습니다.
308,이소정,5,2025-03-22,디자인이 깔끔해서 쓰기 편해요.쿠팡플레이 보면서 필요한 건 쿠팡에서 또 주문하고 배고프면 이츠에서 시켜먹고 돈이 좀 들긴 해도.. 세상이 이렇게 좋아지다니ㅠ 아 근데 주소 입력시 다 입력 안 해도 등록이 되는 등 이런 건 수정 해야 할 거 같아요.고객 입장에선 등록이 다 되니 본인이 주소를 다 적었다고 착각하게 되니까요.아무튼 쿠팡이츠 써 보면 나가기 귀찮거나 할 때 정말 좋습니다.
309,두울리,3,2025-03-11,배달비.무료맞음?? 와우 회원인데 배달비가 똑같이 적용 하는데 매장에서 배달비.책정하면 배달비 무료가 아닌거 같네요. 아니그리고 같은 가게인데. 배민보다 왜? 쿠팡 메뉴 가격이 2~3천원이나 더 비싸죠이건 머하자는건가요. 가격같은건 업소에 걍 맡기는건가요.. 시스템이
310,그린곰,4,2025-03-06,전체적으로 너무 좋은데 월회비는 비싸지고 가게 수가 타 업체에 비해서 적어서 쿠팡이츠를 계속 쓸지 고민됨.. 마지막에 결제할 때 배달인지 포장주문인지 한번 더 상기시켜주는 점이 좋았음. 배달 기사가 실 수 해서 안가져다주면 가게측에서 기사와 연락이 닿지 않아 고객으로서 뭐 어쩌라는 건지 모르겠음.
311,E Lee,5,2025-04-03,남아공 핸드폰이라 설마했는데 어플만 깔면 아프리카에서도 한국에 있는 아이들에게 원하는 음식을 바로 배달시켜 줄 수 있어서 너무 좋아요. 일년에 몇 달씩 나와있어야 하는데 이렇게라도 아이들에게 음식 배달을 바로 해 줄 수 있으니 너무 감사할 따름입니다.
312,Serendipper,1,2025-04-04,"네트워크 연결이 원할하지 않답니다 250402 --------------------------------------- 고객센터에 전화해서 문의하니 와이파이 문제아니면 전원을 재부팅하라해서 와이파이를 꺼도 재부팅을해도 같은 문제가 발생합니다 오류문구를 적어드릴께요 ""네트워크 연결이 원할하지 않습니다 연결 상태를 확인하거나 잠시후 다시 시도해 주세요"" 이런 내용입니다 앱을 재설치해도 같은 문제가 발생되며 다른 앱도 이런다면 제 전화기가 문제라고 생각되지만 쿠팡이츠 어플만 이런 오류가 생기네요 쿠팡앱안의 쿠팡이츠로 시켜야하는 불편함이있습니다 해결 부탁드립니다"
313,류진주,5,2025-04-16,지역마다 매장 차이가 크긴한데 일단 대구에서는 배민에도 없는 영업장이 꽤나 있어서 저는 배민보다 쿠팡잇츠를 더 많이 이용하고 있습니다. 쿠폰도 매일 다르게 계속해서 뿌리니깐 메뉴 고민할 필요도 없이 할인되는거 위주로 시켜먹고 자주 주문하거나 최근에 본 매장도 쉽게 보여줘서 너무 좋아요 그리고 음식이 어디까지 왔는지 확인할 수 있어서 좋습니다 아직까지 단점을 찾지 못한게 단점이라고 할 수 있겠네요
