,customer_id,star,enroll_date,content
87,Tasty Waffle 테이스티 와플,5,2023-12-08,너무 좋아요. 편리하고 할인도 많이 되는게 짱 좋아요 그리고 하나더! 배달이 엄청 빨라서 최고입니다. 그런데 리뷰보여지는곳이 좀 더 명확하게 나왔으면 좋겠고 리뷰쓸때 사진하나만 선택되는게아니라 여러장 선택되게 되었으면 좋겠어요. 그외 모든건 정말 너무 좋네요! 짱!
88,긱스,3,2021-11-10,이용은 잘 하고 있습니다만...무료배달 이라는 문구는 수정이 필요하겠네요. 조건부 무료라던지... 대부분이 무료배달이라고 되있는데 자세히 눌러야만 배달요금을 정확히 볼수있네요. 무료라고 써놓고 조건이 있으면 고지를 해줘야 하지 않나요? 안보고 결제한 사람은 분명 짜증날텐데요. 이런 기만행위는 수정 되었으면 합니다.
89,이아리,5,2023-08-15,"이 기능만 들어가면 다시 배달의 민족에서 쿠팡이츠로 돌아갈 의사 있음 쿠팡이츠는 고객 응대도 잘해주시는데 고객응대 꽝인 배달의 민족은 이 기능 하나때문에 씁니다. 자취를 오래한 사람들은 특정 메뉴나 재료의 키워드 일부만 검색했을 때 검색된 리스트 중에 원하는 키워드로 풀 메뉴가 보이는지 여부에 따라 가게 클릭을 하냐마냐 결정하는데 쿠팡이츠는 일부 키워드 검색을 해도 어느 메뉴와 싱크가 맞아 검색이 된건지 전혀 모르겠습니다. 예를 들어 '참마 주스'가 먹고싶어서 키워드에 '마주스'로 검색한다면 쿠팡이츠는 일단 뭔가 나오지만 정작 검색된 가게에 들어가면 마주스가 없는 경우가 많아 모두 클릭을 해봐야 압니다. 배달의 민족은 같은 키워드를 검색하면 '고구마주스'가 있는 A가게, '참마주스'가 있는 B가게 두개가 나와서 B가게만 클릭해서 빠른 주문이 가능합니다. 이 기능을 넣어주세요, 음식 만들기 귀찮은 사람들이 시켜먹는 곳입니다. 귀찮은 일을 줄일 수 있게 해주세요."
90,Yoongjoon Kim,5,2024-09-14,"사용하기 편리하고, 배달기사님이 어디로 어느 길로 오는지도 볼 수 있고, 우리집 앞에 도착했길래 엘리베이터 올라올때까지 현관문 열고 기다렸어요. 불편한 점은 리뷰사진을 앱에서 바로 촬영후 붙일 수가 없고, 미리 촬영한 걸 앨범에서 추가하는 형식이라서 안 좋았어요."
91,김창성,3,2024-05-18,배달어플 자체를 처음 써서 다른 곳과의 차이는 모르겠으나 별다른 불편은 못 느꼈습니다. 다만 제 폰 기종이 폴드5인데 큰화면 사용시에는 ui가 너무 커서 배너가 모든걸 가려버리더군요. 수정이 필요해 보입니다. 또 알람 설정이 주문과 배달 확인때마다 계속 올라옵니다.
92,정연훈,5,2024-04-04,"최근 배달료 무료로 바꼈는데 상황에 따라 배달료 무료가 기존 10% 할인보다 비싸지는 경우가 있어 아쉽습니다. 따라서 와우회원들을 위해 10% 할인 + 배달료 무료 방법은 어떨까요? 이게 안 된다면 5월 31일 이후에도 주문할 때마다 직접 10% 할인을 받을지, 아니면 배달료 무료를 선택할 지 고를 수 있었으면 좋겠습니다. 더 좋은 서비스를 기대하겠습니다. 감사합니다."
93,밍구리링,4,2023-02-22,"편리하고 좋아요 다만, 가게 요청사항을 적을 때 적는 란이 늦게 올라오는 버그가 있습니다. 제 핸드폰에서만 그런지는 모르겠으나 꽤 지속되어 앱 삭제 후 재설치해도 동일한 증세가 있네요. 그점이 불편합니다. 혹시몰라 적어둡니다. 갤럭시노트8 입니다."
94,루자,3,2021-02-01,잘 보셔야할게 가게서 직접 사는거랑 배달해서 메뉴 시키는 거랑 품목당 500원에서 2000원 더 비싼곳이 많습니다. 배달료까지 지불하는 입장에서 4~5가지 메뉴를 시키면 만원가량 비싸게 먹는거에요... 배달료 싸고 저렴한 집들 네이버 검색해서 메뉴가격 확인해보고 차이 있는지 없는지 꼭 확인해보세요~ 이것들이 꼼수 부립니다!!
95,로블리,1,2024-06-04,지방이라 쿠팡이츠 이용 업체가 많지 않아요. 무료배달이라고 해놓고 주문 상품금액이 상이한곳이 있어요. (기존보다 1~2천원 높게 셋팅해둠) 이런식면 누가 이용하나요...일정금액 이상 주문시 사용 할 수 있는 쿠폰이 현저히 적음. 타사와 비교했을때 같은 업체에서 같은 주문을 똑같이 해도 할인되는것에 차이가 있어요. 무료배달을 왜하는건지...기존이 차라리 나아요. 그리고 회원들이 원하는 OTT를 선택해서 이용 할 수 있다면 더 좋을 것 같아요.
96,juicy jay (Juicycool),1,2022-08-07,"배달료 이슈도 많은데, 제발 소팅할때 최소 로 세팅하지말고 최대로 잡았으면 좋겠음. 검색 필터는 '~ 2000원' 으로 해도 실제 검색결과는 '무료 ~ 4000원' 이따구니 필터고 소팅이고 해도 소용이 없음 필터를 '~2000원' 으로 걸면 검색결과도 '~2000원' 이 나와야하는게 소비자입장에서 진실로 원하는 결과가 아닐까?"
97,김은영,4,2020-07-05,"항상 할인쿠폰이 주어져서 다른앱 보다 많이 활용합니다. 주문도 정확하고 배송도 빠르고 친절해서 좋아요~!! 다만, 주소를 잘 적었음에도 주소의 위치가 엉뚱한 곳을 가르켜서 배달하시는 분이 매번 애 먹으시고, 매번 전화로 다시 설명해야 하는 번거로움이 있습니다. 이것은 꼭 개선해야 합니다."
98,두둥,3,2021-01-22,"배송 위치를 실시간으로 확인할 수 있다는 점이 좋습니다. 다만 배송 누락 시 부분 환불이 불가능하여 쿠폰으로 주는데 이 쿠폰은 중복 적용이 불가하며, 사용 기한이 있습니다. 또한 많은 분들이 말씀하셨듯이 주문 후 몇 초라도 취소를 누를 수 있어야 할듯합니다. 터치 한 번이면 결제가 되어 실수할 가능성이 있습니다."
99,소금소금후추후추,4,2021-09-19,"잘쓰고있습니다~! 마지막업데이트를 아직 안했는데, 버그가 있어 남깁니다 :) 플로우 : 홈 > 검색 > 가게진입 후 메뉴 끝까지 슬라이딩 > 끝 메뉴의 item이 작을 경우, 즉 divider가 슬라이드되며 완벽히 다 올라오지 않을 경우, 메뉴 상단에 카테고리 표시선이 움직이지 않습니다. Ex) 마지막 카테고리 -> 원두 이며, 메뉴가 2개밖에 없을 경우 item이 차지하는 높이가 작으므로, divider가 화면끝까지 오지 않아 메뉴 상단 카테고리선이 바뀌지 않습니다."
100,김정은,2,2023-09-20,"와우멤버 4년차로 나름 쿠팡어플잘 쓰고있는데.쿠팡이츠에서 와우멤버 할인해준다고 해서 할인받아 사용하는 장점도 있지만 카트에만 담아놓고 저녁에 주문하려고했는데 금액확인차 누른다는게 결제되버려서 완전 당황했다. 취소하려고 하니 취소되는.아이콘도 없어서 고객센터에 전화해서 통화연결 기다렸다가 취소하거나, 매장에 취소전화직접 해야되는.단점이있다. 매장에서는 바로 음식준비하면 어쩌려고.. ㅠㅠ 양쪽으로 귀찮게 전화하는 시대도 아니고 취소아이콘정도는 있어야한다고봄."
101,Degital Painting,1,2021-11-21,메뉴 고르는중 확인하다가 결제 되버림. 바로 확인하고 취소하려는데 취소 버튼도 없고 전화번호 확인해서 전화하니 이미 늦었다하고...잔말 많이 잡아도 1분 안팍인데. 이건 간편한 결제가 아니라 무분별한 결제지. 복잡하고 어려운 인증이 문제인데 쉬운 인증 결제가 아니라 주문 과정인듯하면서 결제가 되버리면 돈뺏긴 기분이 든다. 겁나서 못쓸거 같다.
102,루군,2,2023-11-29,어플 업데이트를 하라고 해서 했더니 지속적으로 업데이트 하라는 문구가 나오면서 어플 실행이 아예 안됩니다. 설정 들어가서 데이터 삭제와 캐시 삭제를 다 해도 똑같은 현상이 반복되네요. 쿠팡 어플 업데이트까지 같이 다 했는데도 안됩니다. 해당 현상 확인해서 조치를 부탁드립니다.
103,Sunny,5,2024-01-20,목록엔 영업중인걸로 떠서 막상 들어가서 메뉴선택하면 준비중이라고 나와서 불편해요. 검색 메뉴얼도 아직 적응이 안되서 불편하지만 와우 10%할인 장점으로 일단 더 사용해 보겠습니다. 고객의 불편사항을 얼마나 빨리 수용하고 적용하느냐에 따라 다른 업체와의 경쟁에서 우위를 차지할 수 있어요. 당연한 말이지만요.^^
104,알렁가몰렁,5,2022-09-20,카테고리에서 메뉴 이동 화면 제발 카테고리 (ex.한마리 치킨) 누르면 메뉴(ex.뿌링클)까지 주루룩 내려가는 화면 말고 그냥 한번에 그 화면으로 이동하게 해주세요 눈도 아프고 시간도 오래걸려서 답답해뒤집니다. 선택장애있는 사람들은 그거 하나하나 눌러보고 이미지 확인하느라 시간 다가요.. 다 좋은데 이게 참 아쉽네요 수고하세욥
105,감염된테란,1,2020-08-31,"장점은 다른 앱보다 확실히 배달이 빠르다. 매장 평가에 따라 상위노출 점수를 메기는 시스템 덕분인 듯. 하지만 다른 어플과 같은 매장임에도 배달비가 타 어플에 비해 비쌈. 그리고 메뉴 항목에서 곱빼기, 고기추가 등 여러가지가 빠져 있음. 결론 배달비는 비싼데 메뉴관리는 대충함. 다른곳에 비해 빠르니 후딱 배달 받아 먹고 싶으면 이거 쓰십쇼."
106,J쥬니,1,2021-10-04,"실수로 결제하기 누르거나, 취소하고 싶을때 취소버튼이 없는건지 찾기 어려운건지.. 주문과 동시에 몇초도 안되서 취소도 안되고, 매장에 연락하니 고객센터로, 고객센터에서 매장에 연락하니 음식이 준비되서 취소할수 없다하더이다. 고객편의를 위해서 결제수단도 미리 체크되어 있답니다. 고객편의가 아니라 취소하기 어렵게 회사 편하고 좋으라고 한것 같습니다. 취소나 결제 부분은 개선이 필요하다고 봅니다."
107,Kyoung ah Kim,1,2021-11-10,포장 옵션으로 들어가서 주문하는데도 왜 계속 주소 설정 요청 -> 배달로 전환되나요? 심지어 한번 배달로 전환되면 다시 포장으로 되돌릴 수 있는 옵션도 없네요.. 사용자 경험을 고려하신 게 맞는지 의심스러울 정도 직관적이지도 않고 간결하다고 땡이 아니죠 설명이 이렇게 부족한데 ㅡㅡ
108,김선우,3,2021-01-03,카드가 등록되어있는지 모르고 결제를 눌렀는데 바로 결제가 되었습니다. 카드 등록여부를 확인하지 못한 제 잘못이 있고 터치 한 번으로 주문이 되는 간편한 점은 좋지만 간단한 주문 방법에 비해 주문 취소는 너무 어렵네요. 주문 1~2분 이내에는 주문 취소가 간단히 되도록 했으면 더 좋겠습니다. 아침 먹고 나서 점심에 햄버거를 먹으려고 미리 고르다가 주문버튼을 눌렀는데 타사 앱이 익숙해 결제 방법 선택 이후 결제를 진행할 줄 알았지만 바로 주문 접수가 되어서 상당히 당황했습니다.
109,ROSE장미,4,2024-09-24,지금같은 시국에 무료배달이라는 큰 장점이 있지요. 근데 월회비가 올라 자주시켜 먹지 않음 장점이 안될 수도 있어요. 무료배달이긴 하지만 분식같은 경우는 최소주문금액이 배민보다 높아요. 그리고 주류같은 경우 매번 대면해야하는 번거러움이 매우 불편해요. 주문할 때마다 성인인증으로 바뀌었음 해요. 아 그리고 리뷰 보기가 불편해요.
110,강초원,5,2023-11-06,배달도 빠르고 가게들도 친절해서 항상 잘 이용하고있습니다! 기능에 대해서 한가지 요청드리고 싶은 것이 있습니다. 과거 주문내역을 기간별(주간/월간/기간선택 식으로)로 조회할 수 있는 기능이 생겼으면 좋겠습니다. 감사합니다~
111,와이즈맨,1,2022-10-13,"배달 시킬 때 마다 2,30분 넘게 지연 되는 건 기본이며 배달 기사도 안 정해졌으면서 주문만 잘 받고 지방이랑 수도권 두 지역에서 시켜봤는데 지역 탓이 아니라 여기 자체가 지연이 플러스인 시스템입니다 괜찮게 식사하거나 포장 주문 하실거면 직접 전화하거나 다른 어플 추천합니다"
112,89 pray,3,2023-08-28,살다살다 이런 사용자경험을 겪어보는건 처음이라서 어플리뷰 처음으로 써봅니다. Bhc시키려고 했는데 평소에는 배x쓰다가 갑자기 무슨 변덕인진 모르겠는데 오랜만에 쿠팡이츠로 주문하려다가 기분만 더러워지고 배x어플로 주문했습니다. 어떤 기획자가 그런 컨펌을 수용했는진 모르겠는데 메뉴검색창도 없고 단품메뉴들은 빠져있으며 대표메뉴 바로 아래부터 바로 사이드단품메뉴부터 나오는 구성이 말이 되는건가요..
113,우와앙,5,2024-06-03,"타어플을 자주쓰던 사람입니다. 쿠팡 멤버쉽사용자였는데 쿠팡이츠 소식을 듣고 처음 접하게 되면서 배달주문을 해보았습니다. 사용했던 타어플보다 최고 장점이 많아서 이쪽으로 옮겨외 완전 정착합니다. 배달비, 배달원의 배달현황, 가게 실시간현황 이런 디테일이 있어서 얼마나 기다릴수있는지 알수가 있어서 좋았어요. 뭣보다 배달비나 배달최소가격조건이 1인분주문의 부담이 다른어플에 비해 너무 없어서 최고였어요. 그리고 음식의 옵션 변경하고싶을때 매번 삭제후 추가하곤했는데 여기는 바로 옵션수정이 가능해서 편하네요;;;??? 그리고 리뷰할지말지 메뉴에 선택형으로 두어서 고를수있어서 편합니다. 쿠팡이츠 쓴지 2~3개월 되어가네요. 만족히 잘써서 친구에게도 쿠팡이츠 영업하게 되네요."
114,지잉,5,2024-01-09,실시간으로 배달 현황을 지도로 볼 수 있어서 너무 좋습니다. 다른 어플 쓰는 친구들이 부러워해요. 그리고 다른 어플보다 더 많은 카테고리들로 정리 되어있어서 검색 기능을 딱히 안써도 돼서 좋아요. 쿠팡 원래 많이 쓰는데 와우 할인으로 할인 받을 수 있어서 좋아요
115,JH KWON,2,2021-10-26,쿠팡이츠 앱은 그렇다 쳐도 고객센터의 서비스 품질은 조금 개선하시면 많은 사람들이 즐겁고 편안하게 이용할 것 같습니다. 다양한 음식을 편하게 배달로 제공해 주는 것은 즐거운 경험이지만 고객센터와의 커뮤니케이션은 다시는 겪고 싶지 않은 경험이었습니다.
116,헬리시아,1,2023-08-12,첫 결제로 5000원 쿠폰 적용시키고 할인 적용된거까지 보고 주문하려는데 결제수단추가하라고 해서 인증하고인증하고 겨우 결제 승인 단계까지 왔더니 쿠폰 적용이 해체되어서 첫결제및 할인혜택까지 얻지 못하게됨 결제수단추가시 쿠폰 적용이 리셋되는 버그가 있는지 확인 부탁드립니다. 매장이나 고객센터분들은 매우 친절하고 쉽게 안내를 해주셔서 좋았으나 앱에서 불편한 사항이 발생함.
117,JS l,3,2024-11-24,"평소 배달비까지 포함하면 비싸서 망설였던곳도 무료배송 덕분에 주문할수있어 너무 좋았음. 그.런.데...다른분 리뷰에도 볼수있듯이 배달비받는앱보다 음식금액을 더 비싸게받고 최소주문금액을 터무니없이 높게측정해서 여기서 주문하지말라는식의 매장도 눈에 띕니다. 왜 그러는 걸까요..?또,걸어서 배달하는 배달원도 있는거같던데 이 추운날씨에 음식이 다 식는데ㅠ 바로 코앞 집앞이면 배달 안시켰겠죠 걸어서가긴 애매하게 먼거리여서 배달시킨건데ㅡㅡ;;뚜벅이배달원만나서 덕분에 식은음식먹고 기분안조음 두가지문제점등으로 별점 만점은 못드릴꺼같네요.."
118,RE 2,2,2021-06-21,진짜 진짜 좋고 최고인데 단점은 다른 배달앱 보고 검색ui좀 고쳤으면 함 검색해서 결과가 나와도 뭐가 일치되서 보여진건지 하나도 모르겠고 가게들어가서도 메뉴검색없어서 찾고싶은 메뉴 한참찾다가 내가 검색한거 해당되는거 하나도 없어서 헛짓거리 해본사람 엄청많을거라고 생각됨. 1.배민이나 요기요처럼 검색하면 무슨메뉴가 유사한지 목록에서 먼저보여주면 좋겠음 2.가게들어가서 가게메뉴 내에서 검색기능한번 더있으면 함. 메뉴 엄청많은가게에서는 메뉴찾는데도 한세월임. ㅠ 그래서 맨날 배민에서 메뉴검색다하고 가게이름찾고나어 쿠팡와서 주문하고있음
119,Alejandro Choi,5,2023-09-10,"앱사용 너무잘하고있습니다. 하나 건의드릴건.. 공유용 후기말고 저만 볼수있는 이용했던 가게, 메뉴에대한 메모를 남겨놓을수있는 기능이있음좋겠어요. '혼자먹기양많음''매운재료들어감''a메뉴는 그냥그럼.b가 나은듯.' 뭐 이런 간단한 메모들 붙여놓을수있음 나중에재주뮤할때 참고할수있어서 좋을듯합니다. 가게 리뷰는 사장님, 다른이용자들이 같이 보는거라 별거아닌글도 영향을 미칠까봐 좀 부담스러워요."
120,Euna,2,2023-01-02,시의 경계에 살고 있는데 다른 시의 업체들이 거리상 가까우니 목록에 뜨는데 다른 시라 배달기사님들이 배달을 꺼려하는지 항상 배달이 잘 안잡혀서 음식이 항상 식어있거나 불어서 옵니다. 항상 업체 주소를 체크하기도 힘든데 같은 지역 내의 음식점만 리스트에 뜨는 옵션이 있었으면 좋겠습니다.
121,이유리,3,2024-04-22,"함께주문시 와우회원 배달비 무료 혜택이 적용되지 않나요? 음식을 담을때 화면에는 무료배달 혜택 적용되었다고 뜨는데, 함께주문 페이지로 넘어가면 어느 가게든 8만원 이상 결제시 무료배달이라는 안내 문구가 뜹니다. 각자 결제하는 장점이 있어서 자주 이용하고 싶은데 배달팁 무료 혜택이 적용되지 않는다면 굳이 쿠팡이츠를 사용해야 할 장점을 못느끼겠습니다. 또 어플 내에서 함께주문 배달비에 대한 안내가 부족하다고 생각됩니다. 무료배달, 한집배달 선택하는 창도 뜨지 않아서 뭐지 싶었지만 당연히 무료배달인 줄 알고 주문했다가 배달비가 결제되어서 당황스러웠습니다."
122,Google 사용자,5,2020-04-09,배달 빠르고 배달해주시는 분들도 모두 친절 가맹 음식점 수는 타 업체보다 적긴한데 배달은 훨씬 빠릅니다. 피크 시간대에는 2배 가까이 차이 날 때도 있어요. 음식이 어디까지 왔는지 확인 가능한 기능도 좋고 거의 다 왔을 때 오는 알람도 대단히 편합니다. 음식점 사정으로 주문이 취소 되었을 때 주는 천원 쿠폰도 개꿀
123,Seong-jun Bae,5,2024-01-10,"쿠팡이츠 너무 잘 사용하고 있습니다. 할인 혜택도 푸짐하여, 쿠팡이츠에 등록하지 않은 업체를 제외한 주문에서 다른 딜리버리 앱은 쓰지도 않습니다. 다만 추가되었으면 하는 기능은 쿠팡이츠 내에서(쿠팡 제외) 누적 할인받은금액과 누적 주문금액, 그리고 주문했던 음식 종류별 파이차트 같은 기능이 생기면 앱에 머무르는 시간이 더 길어질 것 같습니다."
124,蠑舞Atira_,5,2024-04-02,쿠팡이츠는 쿠팡와우회원 혜택있다 하여 그때부터 자주 이용했는데 오늘 오랜만에 들어가보니 배달비 횟수제한 없이 무료로 이제 적용되어서 최소금액만 채우면 되는 상황이 되어서 꽤 놀랐어요. 요즘 배달비가 자꾸 인상되어서 시키기가 꺼려졌었는데 정말 좋은 것 같아요. 미약한 단점 1 각자 먹고싶은게 다를 때 이거 시키고 다른 가게가서 또 시키고 해서 배달비도 더 내고 불편함이 있었는데 이게 조금 기능 추가로 개선되면 좋겠어요. 2. 검색 후 가게 영업중이라 떠서 선택하면 준비중인게 있어요 알 수 있음 좋겠어요!(추가된건지 이제 보이네요 맞나?) 3. 배달받는 장소 거리 범위에 맞춰서 거리가 너무 지나치게 멀다면 그 장소가 안 뜨면 좋겠어요. 미금역 배달비가 6천원 정도 했었기 때문에 자꾸 떠서 조금 그랬거든요. 물론 이제 거리 상관 없다곤 하지만 보통 거리가 조금이라도 가까워야 음식이 식지 않아서.. 아니면 원하는 사람만 그걸 선택하게 해주거나요
125,erin P,5,2023-05-21,"타 앱에 비해 메뉴별 분류가 다양하게 되어있어 좋아요!(디저트/간식/샌드위치 등) 한가지 아쉬운 점은 결제시 앱카드 사용이 안된다는 것인데, 추후에라도 앱카드 결제가 가능하였으면 좋겠습니다."
126,이js,5,2023-11-01,"최근에 주문시, 결제수단 변경 버튼 생겼나봐요. 그전에는 어떤 카드가 연결되어있는지 보여주지도 않고 순식간에 결제되서 놀라서 안썼는데. 이게 바뀌어서 잘 쓰고 있습니다 굿"
127,DC K,4,2024-04-18,이용하고 싶은데 불편한 점이 많습니다. 만나서 결제 (카드 및 현금이)가 안 되고 카드 결제도 본인 명의여야만 하는 점입니다. 가족이나 타인과 있으면 다른 분 명의의 카드로 결제하는 순간도 올 텐데 이 점 때문에 이용 못하고 있어요. 무료 배달 취지는 좋습니다. 업데이트 기다리겠습니다.
128,류한석,5,2023-08-21,"와우회원에게는 확실히 좋은 선택지인 것 같습니다. 아직 검색기능은 배달의 민족에 비해 떨어지는 것 같지만, 그 외 부분들(특히 배달 시스템)은 매우 만족스러워요. 주문하는 집이 정해져있는 제게는 쿠팡이츠가 더 좋았습니다."
129,조순선,4,2023-07-09,내위치로 등록 했는데 엉뚱한 곳으로 등록이 된줄 모르고 앱 주문하여 배달 기사분이 못 오는 일이 있었습니다. 내위치 등록은 오류가 있는거 같습니다. 다행히 바로 시정은 되었지만 난감했습니다.
130,전슬비,5,2024-04-07,지역 특성상 배달료가 엄청 비싼편인데 배달비 무료만 해도 4~7천원 할인되는게 너무 기분좋습니다. 배달비 비싸서 못먹던 맛집도 요즘 잘 먹고있어요. 배달비무료 서비스 지속가능여부는 확실하지않지만... 얼마전 어느 매장안에서 식사도중 (타어플)한집배달 기사님 배달가방에 여러가게 상품이 들어있는걸 봤습니다. 그래서 곧 죽어도 여러배달 섞여오는 주문으로 시켰었는데 얼마나 걸릴지 모르잖아요? 쿠팡이츠는 다른가게와 다른집 위치까지 공유가 되어 신기하고 우리집에 언제오는지 보이니까 차분하게 기다리게 되더라구요. 아직 타어플 대비 가게수가 많지는 않지만 유용하게 사용하겠습니다.
131,신정미,4,2024-11-24,대부분 무료배달에 빠르게 도착해서 좋은데요 간혹 다른앱보다 음식값이 더 비싸거나 없는메뉴가 있는곳이 있어요... 무료배달이라고 해놓고 가격을 올려받는거나 저렴한 메뉴는 누락시키는건 잘못된거 같아요... 개선이 필요할듯...
132,쩝후룹,1,2023-01-10,"코앞에서 사기당했네요. 첫주문에 5000원 적용할인이래서 확인까지 다하고 결제버튼 누르자마자 할인쿠폰 적용이 안되고 결제가 되버렸습니다. 너무 당황스러워서 취소부터 하자 싶었는데... 바로 취소하는 버튼이 없어서 찾다가 매장에서 주문수락한후에는 늦었네요. 5000원이 적은 돈도 아니고 덜덜 떨리는 손으로 채팅문의를 했는데, 상담원이 쿠폰을 적용한 이력이 없어 쿠폰을 재발급해주겠다는 답변만 내놓았습니다. 이게 말이 되나요? 날려먹은 제돈은 그냥 잘못쓴거고 다음 주문이나할때 할인이나 하라고요? 다시는 사용하지않겠습니다.. 이런식으로 영업하면 참 돈벌맛 나겠군요."
133,울랄라,1,2024-04-11,"좋아요!!!!!!! 근데 현장결제 좀 부탁해요.......ㅠ0ㅠ 딱하나뿐....ㅎㅎ ------ 2404후기 >>뭐야, 무료배송도 아니고 그렇다고 기존 10퍼센트도 아니고 그냥 10퍼 할인 없애려고 꼼수 부린거에요??? ---240411추가>>네?? 무료배달이 안되는데 무슨 설정이요?? 이전혜택 선택하기 전에 무배가 되야 선택을 하던말던하죠. 그래서 이전 서비스 그대로 유지 눌러도 10퍼 할인도 안되더만요, 뭘. 설정만 만들어놓으셨다고 되는게 아닌거 같네요."
134,이연진,3,2020-12-08,쿠팡이츠에서 첫주문하고 기다렸는데 수락지연 주문취소를 당했습니다. 매장에서 수락을 지연하면 주문취소 되면서 첫주문 할인쿠폰도 사용 못하게 되어 많이 속상했습니다. 개선 필요할 듯... 매장에서 수락지연 경우 수락이 지연되고 있다고 안내문자 주고 기다릴건지 취소할 것인지 고객이 선택하게 한다던지... 고객센터 전화 전까지 매장 탓 했는데 통화해보니 시스템 문제인듯 싶습니다.
