,customer_id,star,enroll_date,content
135,yeony,4,2023-02-04,"배달비를 최저가가 아니라 최대가격으로 보여주면 좋겠어요.. 지급 가능한 배달료가 있는데 3,000원 최대로 검색해도 배달비가 ""무료~""로 뜨는건 무료~6,000원이어도 같이 검색되서 불편해요. 배달비 본다고 몇번 나갔다 들어갔다하면 헷갈려서 다른거 시키거나 다른 앱 쓰게 돼요. 음식마다 후기 수량 적혀있는데 후기도 같이 볼 수 있으면 좋겠어요. 먹고 싶은 음식 후기 보려면 전체 후기에서 하나씩 찾아봐야해서 불편해요."
136,최일귀,3,2024-11-04,"배달비 무료라는데 그래서 와우회원가입해서 돈내고 쓰는데, 다른 배달어플보다 쿠팡이츠에서 주문하려고 보면 음식가격이 더 비싸거나, 세트메뉴에는 메뉴가 한두개 적거나 음식양이 적고, 그러다보니 동일한 메뉴, 음식을 추가로 시켜야되고 결국 총 결제금액은 다른 배달어플은 배달비 포함인데도 거의 비슷하거나 오히려 쿠팡이츠가 비싸네요. 와우회원을 탈퇴해야하나 고민되네요."
137,Hoony,4,2022-10-14,먼저 생긴 배달플랫폼과 비교 하자면 답답하고 속터지는 경우가 많음 내부 규정이 너무 까다로운 점이 한목 하는것 같네요 음식이 잘못 온 경우가 한번 있어서 전화를 했지만 돌아오는 답은 기다려라 알아보고 전화 준다는 답변 뿐...다음부터는 그냥 먹고 있네요 답답한 점만 빼면 아주 좋은 플랫폼 입니다 항상 잘 이용하고 있습니다
138,Hyorim Han,1,2022-09-20,쿠팡이츠는 한번에 한곳만 간다는 배달 정책이 있는거 아닌가요? 요즘 배달하시는 분들의 비정상 운행이 너무 많습니다. 배달 현황보면 누가봐도 다른 음식점 들려서 다른 집(옆단지 등) 갔다가 오는게 보입니다. 비정상 운행으로 문의하면 GPS 탓만 하는데 한두번도 아니고 한번에 한집만 간다고 대대적으로 홍보하고는 실제로 그렇게 운영이 안된다면 별도 조치를 하셔야 한다고 봅니다.
139,김혜련,5,2023-05-29,"리뷰 작성하려는데 메뉴랑 라이더님 좋아요만 누르고 실수로 완료 눌렀는데 리뷰 작성이 끝나더라구요 ㅠㅠㅠ 별점도 드리고 사진도 올리고 싶었는데요.. 이런 경우에 리뷰를 수정할 수 있으면 좋겠고, 어떤 이유때문에 불가능한 거라면 리뷰 수정 불가능한데 이렇게 리뷰 작성 끝낼거냐고 알림이 한번 뜨면 좋겠습니다. 상기사항에 대해 문의드리려 밤에도 운영을 하나 싶어 혹시나 하고 고객센터에 전화했는데 늦은 시각임에도 친절히 응대해주시고 피드백도 바로 주셔서 감사했습니다. 이전엔 와우회원 혜택이 없었던 거 같은데 할인이 생겨서 반갑네요 더 이용 많이 할 거 같습니다!"
140,Dohee,2,2023-11-07,개선이 많이 필요한 어플...할인때문에 사용하고 있긴하지만 타사어플에 비해 허접한건 사실. 우선 본인이 쓴 배달요청사항 확인을 할 수가없어 수정이나 확인이 필요할 시에 본사나 음식점에 직접 연락해야함 주말엔 본사 확인도 안됨. 또한 휴무나 휴업중인 가게가 미리 필터링이 안되서 결제까지 하고 수분 후에 결제취소되고 안내가 됨.
141,미친세상버릇고쳐주지잘해주면ᄇᄉ바보되는세상 (천사도악마로만드는),5,2024-12-05,"장점 1. 엇갈림(오차) 없으면서도, 신속한 배달 매우 만족 칭찬드림 . 2. 쿠폰과 할인제 감사히 잘썼습니다. //단점 1. 말그대로 가게매장(자영업 프렌차이즈점)만 주로 쿠폰할인 가능하고, 일반상품브랜드(예::maxim커피믹스)는 적용안되는점 등이 지금껏까지의 아쉬움입니다. 2. 땅바닥이나 문밖에 두지말고, 계속해서 직접전달 해주시길"
142,햄스터 삼둥이,5,2024-05-15,무료배달이라서 정말 좋습니다. 2식구라서 배달 가격 액수를 높게 정하지 않았으면 해요. 어떤 가게는 3만원 이상인 곳도 있어서 주문 못하는 곳도 있거든요. 음식값도 비싸고 배달비도 비싸서 배달앱 주문 거부감이 있는데 쿠팡이츠 무료배달 생각나서 들어왔는데 할인쿠폰까지 있어서 너무 좋았어요. 다른 앱 탈퇴하고 지웠어요. 만족스러워요.
143,토끼양,1,2022-05-17,결제버튼 실수로 누르면 확인창도 없이 바로 주문들어가는거 고쳐주세요. 적어도 주문하시겠습니까 확인 메시지는 떠야죠. 실수로 주문해서 바로 취소하려고 했는데 곧바로 조리 들어가는바람에 취소도 못하고 가게로 연락하는 방법 찾기도 힘들고 어쩔수 없이 먹었어요. 그 이후로 무서워서 쿠팡이츠 이용 안합니다
144,Haejee Kim,5,2020-08-03,"배민, 요기요의 갑질문제 등으로 인해 배달어플을 끊은지 네달째.. 불편함을 느끼고 대체재로 쿠팡이츠를 다운받아봤습니다. 업체의 다양성과 UX부분 등에서 타 업체와 비교적 부족함이 있을 거라고 생각했던 것과는 달리 기대이상으로 만족한 어플입니다. 우선, '치타배달'이라는 신속함! 지금까지 평균 배달시간이 20분밖에 되지않을 정도로 배달 시간이 매우 빠르다는 것이 장점입니다. '8282의 민족' 한국에서 시간이라는 요소는 퀄리티와 가격만큼 아주 중요한 요소라고 생각합니다. 이 부분에 있어서 다른 경쟁업체보다 경쟁력이 있다고 생각합니다. 나아가 door-to-door 과정을 한 눈에 볼수 있다는 편리함이 장점입니다. 택시어플처럼 배달과정을 지도상에서 실시간으로 볼 수 있어 시간을 정확하게 예측할 수 있으며, 배달 실수 등의 문제를 해결가능할 것이라 생각합니다. 이외에도 더 많은 장점이 있지만 글자수 제한으로 이만 줄입니다. 결론은 QCD 모두 갖춘 쿠팡이츠가 최고라는거👍🏻"
145,한경훈,1,2023-05-21,제가 쿠팡 정말 좋아하는데 쿠팡잇츠는 다시는 이용하고 싶지 않네요. 주문하자마자 잘못된 걸 알고 매장에 전화했더니 주문변경 및 취소는 쿠팡고객센터만 된다고 하고 고객센터는 매장 핑계대면서 메뉴변경도 안된다 주문취소 후 재구매도 안된다고 하고.. 정말 식사 주문 하나 했다가 기분이 엄청 상했습니다.
146,김명화,1,2021-06-18,"주위에서 추천받아서 사용하게 되었는데 배달기사가 중간에 사라지질 않나 연락두절에 음식메뉴는 엉망이 되서 오고 ㅋㄱ ㄱㄱ ㄱㄱ다시는 사용할거 같지 않습니다. 고객지원센터에서도 만족스러운 답변을 받지 못 했네요. 다시는 쓰지 않고,지인들 한테도 열심히 알려야 겠네요!~~ 앞으로도 번창하세요^^"
147,jk k,4,2025-01-19,최근들어 할인하는 곳도 꽤있고 해서 자주 사용중입니다. 예전보다는 매우 만족스러운데 매장별 요청사항 저장기능이 없어 자주 시켜먹는 곳에서 매번 똑같이 적어야하는게 너무 불편합니다. 개선 부탁드립니다
148,ᆞ티모,2,2024-09-21,비 오는 새벽에 배달 시켜먹을려고 했는데 가게 설정으로 인해 배달이 아닌 포장으로 주문이 되어 구매 즉시 취소하려 했으나 매장 직통 전화번호도 없고 주문 취소도 없어서 결국 비 오는 새벽에 미성년자여서 차도 없이 3.4km거리를 가서 포장 받아왔네요 물론 저의 과실도 있지만 구매 즉시 주문취소를 하려 했는데 주문 취소를 일정시간 안에 할수 있는 것과 매장 직통 전화번호는 있게 고쳤으면 하는 바램입니다 앱은 유용하게 쓰고 있어요
149,DD basic,2,2024-11-24,매장에 직접 전화하여 메뉴의 존재를 확인하고 쿠팡이츠 앱에 메뉴가 없다고 문의를 하였더니 10분 전에 연락한 매장이 영업종료되어 확인이 불가능하다니 답장을 받았습니다. 그래서 다른 배달앱으로 확인하여 주문하니 메뉴도 그대로 있고 영업도 계속 하고 있었습니다. 문제를 해결할 의지가 있는 상담사가 배치되었으면 좋겠네요.
150,피아,1,2021-09-06,배달이 차로 20분거리에 있는 기사가 배정됐어요 두번이나.. 참고로 걸어서 10분이면가는집에 배달을 시켰습니다.. ㅋ 이거 배달 이런식이면 손님 떨어지고 망할거같은데요.. 기사님들도 멀리배정 받아서 오래 일못할듯요 기사가 없으면 배달이 느리고 이용자는 점점 빠져나갈거고요
151,YS C,3,2025-07-01,매번 주문 시 마다 보유하고 있는 쿠팡캐시가 강제로 자동 적용되어 있는데 쿠팡 앱처럼 기본값이 미적용인 상태로 개선해주시면 안되나요? 쿠팡캐시는 제가 사용하고 싶을때 사용하고 싶습니다. 강제 적용된 쿠팡캐시를 매번 적용해제 하는게 피로합니다.
152,겐지장인,5,2025-07-17,"터치 오류인지는 모르겠는데 갑자기 결제되었네요. 화면 아래에 있는 결제 버튼을 안누르고 화면을 위로 올리는 상황이라 결제 버튼이 안보이는 상황이였는데 결제창으로 넘어가지고 돈이 빠져나갔습니다. 물론 주문 취소하면 되는거지만, 좀 당황스러웠어요."
153,Choon Mae Kim,5,2025-07-08,쿠팡 회원으로 여러가지 혜택 좋아서 배달음식은 잇츠만 애용합니다.과거 여러가지 불만요소들도 차츰 개선되어 가는점들 좋고 할인 이벤트 좋고 배달상황도 대부분 좋습니다. 더 발전해주시고 편하고 즐겁게 애용할수 있게 운영해주세요~~^!^
154,김희영,5,2025-07-04,"한번 시켰던 맛의 품목을 저장하고 있어서, 맛있었던 품목을 그냥 시키면 되니까..., 고민도 덜었고, 선택한 품목에 대한 후회가 되지 않아서 좋았네요."
155,김장원,1,2025-07-16,결제창에서 왜 쿠팡캐시를 전액사용으로 우선설정했는지 이해가 안되네요 기본 디폴트는 카드결제로 하고 포인트를 쓸지말지를 정해야하는데 그냥 무지성 전액사용으로 기본값이 매겨지니 포인트쓰기싫은 사람들 억지로 유도하는 것처럼 보입니다 이거 해결될때까지 저도 주변사람들한테 무지성으로 알리고 소문내겠습니다
156,홍민준,5,2025-07-16,"전반적으로 배달 기사분도 친절하시고,, 시간에 맞추어서 배달해 주셔서 감사드립니다. 주문하기도 편리하고,, 사용하는데 부족함없이 만족스럽네요"
157,형진,1,2025-07-21,기본적으로 시스템 오류가 심하네요 이벤트 페이지를 들어가도 에러나고. 쿠폰받으려고해도 계속 뺑뺑이 돌게 시키고. 와우회원으로써 배달비 무료혜택도 가게에서 음식값을 올려버리니.. 쓸모가 없고
158,Inha Kim,5,2025-06-16,"와우회원인 경우, 타 배달앱과는 달리 배달비가 무료여서 좋고, 취향에 따라 잘맞는 음식과 음식점을 추천해주어서 쉽게 메뉴를 고를 수 있었어요. 다른 앱 사용 안하고 계속 이용하게 될 듯."
159,김호열,1,2025-07-19,"배달료 공짜라는거 말고는 좋은게 없어요.한집배달도 한집만 배달하는거 아니고, 음식점 카테고리도 다 겹치고, 배달기사들 때문에 음식이 다 식거나 엉망되서 오는 경우가 허다한데 전혀 개선을 안함."
160,TaeYang Shin,2,2025-07-05,앱 잠금 기능이 없네요. 쿠페이 결제로 하면 비밀번호 없이 바로 결제되는거 같은데 그냥 눌려서 배달 진행이 되네요. 앱 기능 업데이트 좀 부탁드립니다.
161,자이언트LOVE,5,2025-07-11,탕수육 깔끔하고 짜장면 맛있었어요 짬뽕맛집처럼 시원한국물에 굿굿! 다음에도 주문할것 같아요 단지 둘이먹기 많아서 탕수육 량을 줄여서라도 세트로 먹을수 있으면 좋겠어요
162,유근준,5,2025-06-06,참 좋은 배송 앱스토어 입니다 배송도 빠르고 주문한 제품 파손된 것 없이 집앞으로 깔끔한 전달해주셔 잘먹고 잘쓰고있습니다 여러가지 다양한 서비스를 제공 하고 계절 따라 싱싱한 각종 야체및 과일. 여러가지 제품을 소개 시켜 주는 것이 시간이 없는 분들께서 좋아 할만한 쿠팡 모바일 앱스토어 짱입니다.
163,현재,3,2025-07-02,키워드를 입력하고 주문많은순 검색하면 별상관도 없는 가게들이 뜬다. 검색기능이 매우 후지다.
164,Google 사용자,5,2025-05-23,"잘 쓰고 있습니다 메뉴마다 리뷰를 볼 수 있으면 좋겠어요 사진 등록되어 있지 않은 메뉴들도 있고, 또 사진은 등록되어 있지만 리뷰는 어떤지 궁금할 때도 있는데, 전체 리뷰에서 그 메뉴 리뷰는 어떤지 찾아야하는 게 힘들어요 메뉴 선택지에서 리뷰를 볼 수 있는 방법이라든가, 전체리뷰에서 상품필터를 골라서 볼 수 있으면 좋겠어요"
165,보라라,1,2025-07-07,한번 주문했고 썩은 음식 받은 식당이 자주 주문한 식당으로 뜨는데 그거 기능 좀 없애주세요. 볼때마다 불쾌하고 쓰지도 않아요. 사용자는.
166,Hinatea J,1,2025-05-28,배달 후 주문내역에서 내가 가게측에 남긴 요청 확인이 안됨. 배달 영수증에 배달 요청이 기재가 전혀 안 되어 있어 라이더가 무시하는 건 다반사임. 타앱에 비해 이런 기본 시스템이 전혀 안되어 있습니다. 상담원들도 진짜 질문 요지 파악 못하고 몇번씩 묻게 함. 아무리 개선 요청해도 바뀌는 건 없습니다.
167,흐음흠,5,2025-06-03,"대중적으로 알려지지않고 프로모션들(이게좀크긴한듯)이 별로없을뿐, 기능이나 ui직관성등은 1~2위 노나먹는 배달어플들 이상이라고 생각함 +25년 6월 추가 저때도 ui직관성 이야기를 했었는데, 점점 난잡해져가서 어디를 눌러야되는건지 헷갈리는 타어플에 비해서 깔끔하게 ☆직관적으로☆ 알 수 있는 아이콘은 여러 연령층 이용하는 쿠팡앱 짬바 어디안간다고 생각함 아주아주훌륭합니다!"
168,박선미,5,2025-05-17,분주한 퇴근길에 구매하러 가기도 주말 휴일에 일부러 가기도 좀.. 번거로워 자주 먹지 못했었는데요~ 쿠팡이츠앱 통해 간편하게 주문해 좋으네요!👍 무료배달등 할인 이벤트도 잘 활용 유익한것 같아요. 쿠팡회원가가 올라 살짝 부담였지만 배달앱을 이용하니 만족스러워요😘
169,김종섭,5,2025-06-22,이용업체가 다른앱에 비교해서 약간 부족? 한것 같아요 추가글: 시간이 지날수록 조금씩 좋아지는 것 같아요* *@계속 사용하면서 아주 좋아지고 있어요 이제 다른 앱은다 지워버렸어요 이츠 즐거워요 *많은 시간이 지난 후의 후기: 지금은 불편없이 아주 잘 사용하고 있어요
170,정경훈,5,2025-05-16,UI 이거보다 더 개선 할 수 있을것 같은데... 이게 최선은 아닐껀데.... PS. 저번에 메뉴가 한눈에 꽉 안차길래 그거땜에 얘기한건데 죄송합니다. 개선했네요 ㅎ
171,JS Y,5,2025-06-01,매번 요청사항에 밑반찬이나 단무지 무등 빼달라는게 귀찮고 불편한데 아예 계정 자체에 해당 기능을 넣은걸 만들어 넣는건 없나요? 그럼 주문할때도 편리하고 가게에서도 바쁠때 분별하기 편리하지 않을까 생각드네요
172,김수정,4,2025-05-13,쿠팡와우 회원이어서 잘 이용하고 있는데 결제가 너무 쉽게되며 넘어가는게 한번씩 불편하네요~ 좀더 메뉴 고민하고 비교하려다가 결제될때가 있어요 ㅎ
173,RAFALE,5,2025-06-12,"이제 편의성은 다 챙긴 거 같은데 알람 기능 분류좀 어떻게 해주세요.. 그냥 배송 완료 알림만 받고 싶은데 주문 받았다, 거의 다왔다 이런 자세한 알림은 끄고싶어요 그리고 리뷰 남겨달라는 알림도요 이런거 다 끌 수 있는 기능 제공 부탁드립니다"
174,손지민,5,2025-05-25,전화한통이 빠르다고 생각했었던 1인입니다 또한자영업자분들에도 전화한통이 더나으리라생각했었구요 어느날부터는 배달앱을사용안하는 내가 무색한사람이되버린 느낌을받으면서 여러어플들이 많지만 쿠이츠만 씁니다 다른어플은 애들이쓰는걸로~
175,Chul Lee,5,2025-06-21,"우연히 사용했다가, 자주 사용하게 된다는... 만약 문제 있었다면, 자주 사용할 리가 없겠지요. 다양한 음식 기호를 다 맞춘다고 봐야지요."
176,김수진,5,2025-05-26,다른분들 후기에도 적혀있던데 저 또한 문제가 생겼을때 빠르게 응대하고 해결해주는게 마음에 들었어요! 무료배달인 점도 매리트고요
177,SY (CZer0),1,2025-06-28,"우리카드 > 다른결제수단 > 네이버페이, 네이버앱으로 로그인 안됩니다. 물론 네이버어플 최신버전이고요 계속안되서 불편해서 결국 글씁니다 갤25+ 사용중"
178,S. Y. P,4,2025-06-17,상시쿠폰 있는 가게도 있고 와우 쓰는 보람을 느끼게 해서 주로 쓰기에 나쁘지 않아요. 다만 요즘은 배달원들이 동네 두세 개는 돌고 오는 듯. 배달 예정 시간 자꾸 늘어나고 음식이 식어서 와요. 유독 쿠팡만...
179,광부,1,2025-06-30,매장번호 확인불가 주문변경 불가능 기획 자체가 잘못됨 잘못주문하면 주문수정이나 취소 불가 고객센터에 무조건 연결해야함 연결하는동안 메뉴는 다 만들어져서 주문 수정불가 이렇게 기획짜놓은사람은 짜르는게 회사에 도움될듯하네요~
180,yunj na,5,2025-06-28,무료배달이 많은게 좋고 빠른배달이 좋아요. 배달 사장님들 위험성이 걱정은 되는데 항상 안전운전에도 유의하셧음 하구요 그리고 좋은 이벤트나 프로모션으로 배달에 쿠폰처럼그런것도 종종 잇엇음 해요
181,Judy Kim,5,2025-06-21,"배달음식은 무조건 쿠팡이츠로 해요. 왜? 거의 대부분이 배달비 무료니까! 아끼려면 만들어 먹어야 하지만 그럴수 없는 것들, 그럴수 없을 때가 잇잔아요. 마침 와우멤버쉽 쓰고 잇으니 일석이조죠. 와우로켓배송 너무 사랑하는데 쿠팡이츠까지^^ 가끔 밥하기 싫을때 똑같은거 먹기 싫을때 쿠팡이츠 유용해요 좋아요"
182,강여사,5,2025-07-12,쿠팡이 좋은게 한번 등록하면 다 이어저서 따로 설정 안해도된다는거 이거진심 편함 새로 등록하고 찾고 정말 편해요
183,김혜임,4,2025-05-16,훌륭하지만 별하나 뺀건 배달의 민족이랑 비교했을때 가격차이가 꾀 나는 경우가 많습니다. 배달비 감안했을때는 싸지만 그래도 눈땡이 맞는 기분은 좋진않죠.
184,홍상빈,1,2025-06-21,"제가 오늘 쿠팡이츠 앱을 설치하고 들어가니까 와우회원 15,000원 쿠폰을 받으려고 하다가 다른 어떤 화면이 떠서 눌렀고 이후 다시 쿠폰 받는 화면으로 돌아왔지만 빈 화면만 떠 있었고 그대로 휴대전화 뒤로가기 버튼을 누르니 쿠폰도 지급이 안 된 채로 그 기회가 사라졌습니다. 그 쿠폰은 6월 22일까지 사용 가능이라고 적혀있었습니다."
185,박은영,3,2025-06-30,본인명의 결제수단만 적용되는거 너무 불편하고 주문절차가 너무 단번에 이뤄져서 장바구니에 담아 가격비교할 틈도 없이 주문이 되버려 곤란한경우가 많네요.
186,끼룩,5,2025-05-17,"배달현황 보여서 좋아요. 가게마다 본인만 확인가능한 메모기능 있으면 좋겠어요. ex. @@@중식집 -> 짬뽕 맛있음, 탕수육 별로 이런식으로요!"
187,김진희,5,2025-06-15,쿠팡이용하면 무료로 이용가능하고 한집배달비도 비싸지않아서 배*클럽 오래사용했는데 갈아탔어요. 다만 음식점수가 좀더다양해지면 좋을거같아요
188,황희열희,5,2025-06-09,선택 주문하기 편리해서 좋아요. 중간중간에 진행상황 알림으로 볼수있어 좋구요 가끔 쿠폰도 받을수 있어 좋구요 역시 쿠팡이네요.
189,지영,3,2025-05-15,얼마 전부터 즐겨찾기한 가게가 한번에 안뜨는 오류가 생깁니다 몇번 들어갔다 나갔다 해야 떠요 확인 부탁드립니다 별개로 주소지를 여러개 사용하는데 주소지별로 즐겨찾기 매장을 구분해서 볼 수 있었으면 좋겠어요
190,Kevin,1,2025-05-31,"첫결제 10,000 쿠폰 써지지도 않던데? 도대체 뭐가 할인된다는거? 결제 화면전에서는 할인가격인데 막상 탭해서 결제내용 보면 가격 그대로 다 받던데? 뭐임? 막상 쿠폰 보면 사용됨으로 나오고 배달내역도 안남던데 원래 이런건가요?"
191,이름,4,2025-06-05,"결제페이지 들어갈때마다 GPS 위치 켜라는 팝업이 반복해서 뜹니다 닫아도 쿠폰이나 요청사항 칸 이동할 때마다 뜨는데, 배달 앱에서 배달주소 외에 사용자 위치 정보 요구하거나 GPS 설정 강제하는 경우는 처음 봅니다 몇년째 이러고 있어요 개선되길 바랍니다"
192,후추곰이,5,2025-07-16,배달의**보다 나아요.라이더위치 확인도 되고 에로사항 처리도 신속하게 진행되요.쿠팡이츠만 씁니다.
193,양성호,5,2025-06-14,요즘 고물가시대에 너무너무 좋은가격에 행사도 많이많이 하시고 착한 가격에 맛난 배달음식도 시켜먹을 수 있고 너무너무 좋네용^^
194,다시쩡,5,2025-06-07,일단 문제처리가 배x보다 훨신 적극적이고 빠르고 조취도 매우 좋습니다 맨날 말로만 관할부서 넘겨서 어쩌고가 아니라 진짜로 신속하게 반영해주고 문제 됐던거에 대해 쿠폰도 주고 고객의 소리를 무시안해요
195,김나래,5,2025-06-02,무료 배달 되서 좋아요!! 배달비용도 배민보다 적게 들고요~~~!!! 가끔 원하는 지점이 없을때도 있지만.. 그래도 넘나 만족스러워요~~
196,김푸름,5,2025-07-03,사장님들만 볼수있는 비밀리뷰를 쓸수있는 기능이 있었으면 좋겠어요 좋았던집이었는데 조금 아쉽게 바뀌었으면 고객입장에서 조용히 알려드리고 싶은가게도 있거든요
197,ᄋᄋ,4,2025-06-16,메뉴 선택하면 그 메뉴 리뷰만 볼 수 있는 기능도 있으면 좋겠어여 리뷰다 다 통합이라 아쉬워요
198,스타일린,5,2025-04-26,쿠팡 와우 회원이면 무배도 가능하고. 자주 애용합니다. 조금 불편한 부분이 있는데.. 리뷰 작성한분들 참고해서 최대한 고쳐 나가면 ㅂㅁ 앱 보다 지금도 훨씬 좋지만.. 편의성도 좋아져서 더 이용자가 많아질듯 합니다.
199,양승규,1,2025-06-02,그래요..그냥 ...배달 시켰고 ..시간 지난후 가게로 전화 드렸는데..갔어요! 끝...중국음식을 1시간 있다 받았네요 뭔가 ..점검정도가 ..있어야 할듯
200,오재인,1,2025-06-26,써보니 최악입니다 15000원 이상 배달 가능한 NH농협카드 쿠페이 머니 12000원 쿠폰 받고 나서 메뉴 시켰는데 쿠폰 사용을 제가 분명히 눌렀는데 사용이 전혀 안된채로 주문이 되었습니다 적용되었다면 11300원으로 주문됐을텐데 23300원으로 주문이 되고 말았습니다 쿠폰 혜택이 전혀 안되는 배달앱은 처음봤습니다 이럴거면 배달전용 쿠페이 머니 12000원 쿠폰 왜 사용하라고 하시는 겁니까? 다시는 이앱 전혀 안쓸거예요
201,Hyo-Young Son,4,2025-05-06,"일반결제 가능하다고 해서 주문해볼까 했는데... 법인카드는 영수증 발급이 안되네요. (승인번호가 적혀 있는 매출전표) 배민, 요기요는 메일로 받아 볼 수 있게 기능이 되어 있는데.... 쿠팡이츠도 메일로 영수증 받을 수 있도록 기능 추가해 주시면 고맙겠습니다."
202,박성근,5,2025-06-12,배달비도 무료고 배달도 빠르고 음식도 따끈따끈하고 맛있게 잘 먹을 수 있는 거 같아요. 강력 추천입니다.😄👍
203,김상미,4,2025-05-22,메뉴별 리뷰 열람 기능 및 블랙리스트 (다시는 주문하고 싶지 않은 업체) 설정 기능이 추가되면 좋겠습니다
204,성수정,3,2025-07-08,배달의 민족처럼 위생인증 업체 표시 해주세요. 요식업 종사해보신 분들은 알겠지만 위생은 진짜 천차만별입니다. 굉장히 중요한 부분이라 가게 테두리를 금색처럼 두르던 지 아니면 특별히 표시해주시던 지 하셔야 할 거 같아요.
205,ironman c,1,2025-07-02,같은 음식점 같은 음식인데 요기요보다 비쌉니다 와우회원인데도 비싸면 어쩌라는건가요? 와우회원 무료배송? 음식값에 덮어 씌우고 비싸게 팔고 배송비 안받고... 눈가리고 아웅이네요 최악입니다 그리고 왜 평점이 낮은 리뷰는 더보기 안누르면 뜨지도 않나요?
206,이성준,2,2025-07-09,무료배달 시키면 30분 온다 적혀져 있는데 정작 오는건 대부분 50분에서 1시간10분 사이로 도착이 따지면 그러면 한집배달 시키던가 라는 반응이 일관 그냥.. Goa ! t 앱. 딸배 한번 배달할때 2 ~ 3곳들르던데 좀 喝하고 자제좀 시켜봐라 오토바이면 빨리 오니깐 괜찮은데 차량이나 자전거가 늦어 터졌으면서 욕심내가지고 주문 여러게 잡는거 꼴받는데 오토바이 딸배를 늘리라고
